# model_pattern|command_pattern|expected|note|required
# Auto-generated by scripts/generate_adequacy_expectations.sh.
# First matching rule wins. Keep specific rules above wildcard defaults.

models/dogfooding/adequacy/pass.pf|Obl_A_exec|UNSAT|Autogenerated from models/dogfooding/adequacy/pass.pf (ADEQ-CONCERN-COVERAGE-001)|required
models/dogfooding/adequacy/fail.pf|Obl_A_exec|UNSAT|Autogenerated from models/dogfooding/adequacy/fail.pf (ADEQ-CONCERN-COVERAGE-001)|required

*|*|SAT|Default fallback for commands outside the selected adequacy fixture contract|optional
